{"body_tracking":{"joint_set":"UPPER_BODY","max_pose_age_ms":50,"qualification_profile_id":"UNQUALIFIED","require_iobt":false,"require_runtime_profile_match":true,"required":true,"shoulder_joint":"Body_RightShoulder"},"build_profile":"Release","grasp":{"default_mapping":"IDENTITY","fallback_provider":"DISABLED","provider":"OPENXR_HAND_INTERACTION","require_grasp_ready":true},"hand_tracking":{"required":true,"wrist_dropout_grace_ms":null,"wrist_joint":"Wrist","wrist_max_pose_age_ms":50},"network":{"control_key_id":"phantom01-control","default_port":30470,"discovery_service":"_phantom-ev3._udp.local","protocol_version":1,"telemetry_max_age_ms":100},"qr":{"required_markers":["SHOULDER_LEFT","SHOULDER_RIGHT","TURRET_LEFT","TURRET_RIGHT","ELBOW_LEFT","ELBOW_RIGHT","GRIPPER_LEFT","GRIPPER_RIGHT","JAW_LEFT","JAW_RIGHT"],"required_only_before_ready":true,"runtime_tracking_required":false},"robot_id":"phantom01","schema_version":1,"space":{"require_anchor_support_for_qr":true,"require_current_room":false,"require_local_floor":true,"require_scene_floor_anchor":false,"require_scene_support_for_qr":true,"require_spatial_data_permission":true,"scene_aware_ux_enabled":false}}
